{"report_version":1,"schema":"einvoice-conformance-report/v1","source":"fixtures/synth-ubl-good-intra-community_ubl.xml","profile":"xrechnung","valid":true,"fatal_count":0,"warning_count":0,"violation_count":0,"violations":[],"syntax_bindings":[],"syntax_binding_fatal_count":0,"syntax_binding_warning_count":0}
