{"report_version":1,"schema":"einvoice-conformance-report/v1","source":"corpus/synthetic/synth-ubl-good-xrechnung.xml","profile":"xrechnung","valid":true,"fatal_count":0,"warning_count":1,"violation_count":2,"violations":[{"rule":"BR-DE-19","severity":"warning","message":"'Payment account identifier' (BT-84) should be a correct IBAN when 'Payment means type code' (BT-81) is 58 (SEPA).","field":"cac:PaymentMeans/cac:PayeeFinancialAccount/cbc:ID","title":"With payment means code 58 (SEPA credit transfer), BT-84 should be a correct IBAN (official regex + mod-97 transcription).","fix_hint":"Correct `/ubl:Invoice/cac:PaymentMeans[normalize-space(cbc:PaymentMeansCode) = ('30','58')]` so that with payment means code 58 (SEPA credit transfer), BT-84 should be a correct IBAN (official regex + mod-97 transcription).","terms":["BT-81","BT-84"],"location":"/ubl:Invoice/cac:PaymentMeans[normalize-space(cbc:PaymentMeansCode) = ('30','58')]","element":"cac:PaymentMeans/cac:PayeeFinancialAccount/cbc:ID"},{"rule":"BR-DE-TMP-32","severity":"information","message":"The invoice should state the delivery/service date: BT-72 'Actual delivery date', BG-14 'Invoicing period', or BG-26 'Invoice line period' on every line.","field":"cac:Delivery/cbc:ActualDeliveryDate","title":"An invoice should state the delivery/service date via BT-72 (Actual delivery date), BG-14 (Invoicing period) or a BG-26 (Invoice line period) on EVERY line.","fix_hint":"Correct `cac:Delivery/cbc:ActualDeliveryDate` so that an invoice should state the delivery/service date via BT-72 (Actual delivery date), BG-14 (Invoicing period) or a BG-26 (Invoice line period) on EVERY line.","terms":["BG-14","BG-26","BT-72"],"location":"cac:Delivery/cbc:ActualDeliveryDate","element":"cac:Delivery/cbc:ActualDeliveryDate"}],"syntax_bindings":[],"syntax_binding_fatal_count":0,"syntax_binding_warning_count":0}
