{"report_version":1,"schema":"einvoice-conformance-report/v1","source":"corpus/pdf/facturx-truncated.pdf","profile":"xrechnung","valid":false,"error":"unsupported-container","message":"unsupported container \u2014 could not extract embedded invoice XML: no classic PDF trailer \u2014 cross-reference stream / object-stream PDFs (PDF 1.5+) are not supported by the zero-dependency extractor","fatal_count":0,"warning_count":0,"violation_count":0,"violations":[]}
